<?xml version="1.0" encoding="UTF-8"?>
<!DOCTYPE catalog [
  <!ELEMENT catalog (book*)>
  <!ELEMENT book (title, author, price)>
  <!ELEMENT title (#PCDATA)>
  <!ELEMENT author (#PCDATA)>
  <!ELEMENT price (#PCDATA)>
  <!ATTLIST book
    id ID #REQUIRED>
]>
<catalog>
  <book id="bk101">
    <title>Book One</title>
    <author>John Smith</author>
    <price>39.95</price>
  </book>
  <book id="bk102">
    <title>Book Two</title>
    <author>Jane Doe</author>
    <price>59.95</price>
  </book>
</catalog>